{
  "id": "motion-layout-group",
  "name": "Layout Group",
  "source": "motion",
  "canonical_page": "https://motion.dev/docs/react-layout-group",
  "repository_path": null,
  "preview_available": true,
  "framework": "react",
  "styling_technology": "CSS",
  "animation_technology": "Motion (Framer Motion)",
  "dependencies": [
    "motion"
  ],
  "required_assets": [],
  "browser_requirements": "modern evergreen",
  "installation_method": "npm motion",
  "copy_paste_available": false,
  "license": "MIT",
  "component_exceptions": null,
  "attribution": null,
  "redistribution_permission": true,
  "commercial_use": "yes",
  "modification": "yes",
  "accessibility_status": "unknown",
  "reduced_motion_support": "yes",
  "responsive_behaviour": "good",
  "performance_cost": "medium",
  "complexity": "medium",
  "quality_status": "high",
  "usability_mode": "installable",
  "verification_date": "2026-06-27",
  "evidence": [
    "https://motion.dev/docs/react-layout-group"
  ]
}
