{
  "id": "magic-ui-bento-grid",
  "name": "Bento Grid",
  "source": "magic-ui",
  "canonical_page": null,
  "repository_path": null,
  "preview_available": true,
  "framework": "react",
  "styling_technology": "Tailwind CSS",
  "animation_technology": "CSS / Framer Motion",
  "dependencies": [
    "framer-motion"
  ],
  "required_assets": [],
  "browser_requirements": "modern evergreen",
  "installation_method": "varies",
  "copy_paste_available": true,
  "license": "MIT",
  "component_exceptions": "Adapt the interaction concept; do not copy/port the source into another framework.",
  "attribution": null,
  "redistribution_permission": false,
  "commercial_use": "yes",
  "modification": "yes",
  "accessibility_status": "partial",
  "reduced_motion_support": "unknown",
  "responsive_behaviour": "good",
  "performance_cost": "low",
  "complexity": "medium",
  "quality_status": "high",
  "usability_mode": "adaptable",
  "verification_date": "2026-06-27",
  "evidence": []
}
