{
  "id": "shadertoy-raymarch-clouds",
  "name": "Raymarched Clouds Shader",
  "source": "shadertoy",
  "canonical_page": null,
  "repository_path": null,
  "preview_available": true,
  "framework": "vanilla",
  "styling_technology": "WebGL fragment shader",
  "animation_technology": "GLSL shader",
  "dependencies": [],
  "required_assets": [],
  "browser_requirements": "WebGL2-capable browser / GPU",
  "installation_method": "varies",
  "copy_paste_available": false,
  "license": "Per-author; default CC BY-NC-SA 3.0 unless author sets otherwise",
  "component_exceptions": "Reference/inspiration only; verify per-element licence before any reuse.",
  "attribution": null,
  "redistribution_permission": false,
  "commercial_use": "unclear",
  "modification": "unclear",
  "accessibility_status": "unknown",
  "reduced_motion_support": "no",
  "responsive_behaviour": "partial",
  "performance_cost": "high",
  "complexity": "high",
  "quality_status": "medium",
  "usability_mode": "reference-only",
  "verification_date": "2026-06-27",
  "evidence": []
}
