{
  "id": "autoanimate-list",
  "name": "Auto Animate List",
  "source": "autoanimate",
  "canonical_page": "https://auto-animate.formkit.com/",
  "repository_path": null,
  "preview_available": true,
  "framework": "react",
  "styling_technology": "CSS",
  "animation_technology": "Web Animations API",
  "dependencies": [
    "@formkit/auto-animate"
  ],
  "required_assets": [],
  "browser_requirements": "modern evergreen",
  "installation_method": "npm @formkit/auto-animate",
  "copy_paste_available": false,
  "license": "MIT",
  "component_exceptions": null,
  "attribution": null,
  "redistribution_permission": true,
  "commercial_use": "yes",
  "modification": "yes",
  "accessibility_status": "partial",
  "reduced_motion_support": "yes",
  "responsive_behaviour": "good",
  "performance_cost": "low",
  "complexity": "low",
  "quality_status": "high",
  "usability_mode": "installable",
  "verification_date": "2026-06-27",
  "evidence": [
    "https://auto-animate.formkit.com/"
  ]
}
