{
  "id": "rive-interactive-icon",
  "name": "Interactive Icon",
  "source": "rive",
  "canonical_page": "https://rive.app/docs/runtimes/react/react",
  "repository_path": null,
  "preview_available": true,
  "framework": "react",
  "styling_technology": "CSS",
  "animation_technology": "Rive (state machine)",
  "dependencies": [
    "@rive-app/react-canvas"
  ],
  "required_assets": [
    "icon.riv"
  ],
  "browser_requirements": "modern evergreen",
  "installation_method": "npm @rive-app/react-canvas",
  "copy_paste_available": false,
  "license": "MIT",
  "component_exceptions": null,
  "attribution": null,
  "redistribution_permission": true,
  "commercial_use": "yes",
  "modification": "yes",
  "accessibility_status": "unknown",
  "reduced_motion_support": "unknown",
  "responsive_behaviour": "good",
  "performance_cost": "medium",
  "complexity": "medium",
  "quality_status": "high",
  "usability_mode": "installable",
  "verification_date": "2026-06-27",
  "evidence": [
    "https://rive.app/docs/runtimes/react/react"
  ]
}
