{
  "id": "uiverse-neon-toggle",
  "name": "Neon Toggle",
  "source": "uiverse",
  "canonical_page": null,
  "repository_path": null,
  "preview_available": true,
  "framework": "vanilla",
  "styling_technology": "CSS",
  "animation_technology": "CSS",
  "dependencies": [],
  "required_assets": [],
  "browser_requirements": "modern evergreen",
  "installation_method": "varies",
  "copy_paste_available": false,
  "license": "MIT (community-submitted; verify per element)",
  "component_exceptions": "Reference/inspiration only; verify per-element licence before any reuse.",
  "attribution": null,
  "redistribution_permission": false,
  "commercial_use": "unclear",
  "modification": "unclear",
  "accessibility_status": "poor",
  "reduced_motion_support": "unknown",
  "responsive_behaviour": "partial",
  "performance_cost": "low",
  "complexity": "low",
  "quality_status": "medium",
  "usability_mode": "reference-only",
  "verification_date": "2026-06-27",
  "evidence": []
}
