{
  "id": "tsparticles-preset",
  "name": "Particles preset",
  "source": "tsparticles",
  "canonical_page": null,
  "repository_path": null,
  "preview_available": true,
  "framework": "vanilla",
  "styling_technology": "CSS",
  "animation_technology": "CSS",
  "dependencies": [],
  "required_assets": [],
  "browser_requirements": "modern evergreen",
  "installation_method": "npm @tsparticles/engine",
  "copy_paste_available": false,
  "license": "MIT",
  "component_exceptions": null,
  "attribution": null,
  "redistribution_permission": true,
  "commercial_use": "yes",
  "modification": "yes",
  "accessibility_status": "unknown",
  "reduced_motion_support": "no",
  "responsive_behaviour": "unknown",
  "performance_cost": "high",
  "complexity": "medium",
  "quality_status": "medium",
  "usability_mode": "installable",
  "verification_date": "2026-06-27",
  "evidence": []
}
