{
  "id": "shadcn-vue-command",
  "name": "Command",
  "source": "shadcn-vue",
  "canonical_page": "https://www.shadcn-vue.com/docs/components/command",
  "repository_path": null,
  "preview_available": true,
  "framework": "vue",
  "styling_technology": "Tailwind CSS",
  "animation_technology": "CSS",
  "dependencies": [
    "reka-ui"
  ],
  "required_assets": [],
  "browser_requirements": "modern evergreen",
  "installation_method": "shadcn-vue registry",
  "copy_paste_available": true,
  "license": "MIT",
  "component_exceptions": null,
  "attribution": null,
  "redistribution_permission": true,
  "commercial_use": "yes",
  "modification": "yes",
  "accessibility_status": "good",
  "reduced_motion_support": "yes",
  "responsive_behaviour": "good",
  "performance_cost": "low",
  "complexity": "medium",
  "quality_status": "high",
  "usability_mode": "installable",
  "verification_date": "2026-06-27",
  "evidence": [
    "https://www.shadcn-vue.com/docs/components/command"
  ]
}
