{
  "id": "r3f-floating-mesh",
  "name": "Floating Mesh",
  "source": "react-three-fiber",
  "canonical_page": null,
  "repository_path": null,
  "preview_available": true,
  "framework": "react",
  "styling_technology": "WebGL",
  "animation_technology": "useFrame render loop",
  "dependencies": [
    "three",
    "@react-three/fiber",
    "@react-three/drei"
  ],
  "required_assets": [],
  "browser_requirements": "WebGL2-capable browser",
  "installation_method": "npm",
  "copy_paste_available": true,
  "license": "MIT",
  "component_exceptions": null,
  "attribution": null,
  "redistribution_permission": true,
  "commercial_use": "yes",
  "modification": "yes",
  "accessibility_status": "unknown",
  "reduced_motion_support": "no",
  "responsive_behaviour": "good",
  "performance_cost": "high",
  "complexity": "high",
  "quality_status": "high",
  "usability_mode": "installable",
  "verification_date": "2026-06-27",
  "evidence": []
}
