{
  "id": "aceternity-aurora-bg",
  "name": "Aurora Background",
  "source": "aceternity-ui",
  "canonical_page": null,
  "repository_path": null,
  "preview_available": true,
  "framework": "react",
  "styling_technology": "CSS",
  "animation_technology": "CSS",
  "dependencies": [],
  "required_assets": [],
  "browser_requirements": "modern evergreen",
  "installation_method": "varies",
  "copy_paste_available": false,
  "license": "unknown / per-component",
  "component_exceptions": "Licence unclear per component; reference design only until verified.",
  "attribution": null,
  "redistribution_permission": false,
  "commercial_use": "unclear",
  "modification": "unclear",
  "accessibility_status": "poor",
  "reduced_motion_support": "no",
  "responsive_behaviour": "unknown",
  "performance_cost": "high",
  "complexity": "high",
  "quality_status": "medium",
  "usability_mode": "reference-only",
  "verification_date": "2026-06-27",
  "evidence": []
}
