{
  "id": "rough-notation-highlight",
  "name": "Sketchy Highlight Annotation",
  "source": "rough-notation",
  "canonical_page": null,
  "repository_path": null,
  "preview_available": true,
  "framework": "vanilla",
  "styling_technology": "SVG",
  "animation_technology": "SVG path animation",
  "dependencies": [
    "rough-notation"
  ],
  "required_assets": [],
  "browser_requirements": "modern evergreen",
  "installation_method": "npm",
  "copy_paste_available": true,
  "license": "MIT",
  "component_exceptions": null,
  "attribution": null,
  "redistribution_permission": true,
  "commercial_use": "yes",
  "modification": "yes",
  "accessibility_status": "partial",
  "reduced_motion_support": "no",
  "responsive_behaviour": "good",
  "performance_cost": "low",
  "complexity": "low",
  "quality_status": "high",
  "usability_mode": "installable",
  "verification_date": "2026-06-27",
  "evidence": []
}
